First Name,Last Name,Email,Phone,Full Address,Signup,Members
Caleb,Lewis,caleb.lewis.0001@example.com,+13025911540,"8354 Sunset Blvd, Smyrna, DE, USA ChIJ888059827 8354 Sunset Blvd","Jul 6th 2026, 11:52 pm",2
Isabella,Johnson,isabella.johnson.0002@example.com,+13026742095,"9000 Garden St, Georgetown, DE, USA ChIJ250002666 9000 Garden St",2026-07-02,3
Lucy,Robinson,lucy.robinson.0003@example.com,+13024860333,"7297 Pine Rd, New Castle, DE, USA ChIJ701193124 7297 Pine Rd",07/03/2026,4
Gary,Williams,gary.williams.0004@example.com,+13028669885,"2575 River Rd, Bear, DE, USA ChIJ803311674 2575 River Rd","Jul 6th 2026, 11:19 am",4
Alyssa,Brooks,alyssa.brooks.0005@example.com,+13026902708,"670 Lakeview Dr, Milford, DE, USA ChIJ129377423 670 Lakeview Dr",2026-07-05,3
Robert,Bennett,robert.bennett.0006@example.com,+13023913735,"1702 Sunset Blvd, Georgetown, DE, USA ChIJ143674731 1702 Sunset Blvd",07/06/2026,2
Patrick,Brooks,patrick.brooks.0007@example.com,+13026192725,"2545 Sunset Blvd, Georgetown, DE, USA ChIJ233929965 2545 Sunset Blvd","Jul 12th 2026, 10:38 am",4
Samuel,Davis,samuel.davis.0008@example.com,+13029878626,"5250 Washington Blvd, Middletown, DE, USA ChIJ751750225 5250 Washington Blvd",2026-07-08,2
Alex,Allen,alex.allen.0009@example.com,+13025180840,"1454 Willow Way, Middletown, DE, USA ChIJ745803138 1454 Willow Way",07/09/2026,1
Savannah,Edwards,savannah.edwards.0010@example.com,+13022313554,"9753 Valley Rd, Wilmington, DE, USA ChIJ141625908 9753 Valley Rd","Jul 10th 2026, 11:39 am",2
Logan,Nelson,logan.nelson.0011@example.com,+13025850824,"2806 Oak Ave, Seaford, DE, USA ChIJ144503140 2806 Oak Ave",2026-07-11,4
Levi,Stewart,levi.stewart.0012@example.com,+13027761562,"4324 River Rd, Dover, DE, USA ChIJ324800901 4324 River Rd",07/12/2026,1
Sophie,Brooks,sophie.brooks.0013@example.com,+13023099554,"7670 Cedar Ln, Seaford, DE, USA ChIJ347820739 7670 Cedar Ln","Jul 12th 2026, 2:32 am",2
Ian,Bryant,ian.bryant.0014@example.com,+13026426482,"6932 Highland Ave, Georgetown, DE, USA ChIJ399520390 6932 Highland Ave",2026-07-14,2
Austin,Brown,austin.brown.0015@example.com,+13023055367,"8477 Willow Way, Smyrna, DE, USA ChIJ310291357 8477 Willow Way",07/15/2026,4
Hailey,Jackson,hailey.jackson.0016@example.com,+13023696553,"4313 Pine Rd, Wilmington, DE, USA ChIJ199723394 4313 Pine Rd","Jul 3rd 2026, 12:21 pm",3
Aubrey,Moore,aubrey.moore.0017@example.com,+13027422120,"5928 Washington Blvd, Bear, DE, USA ChIJ655839750 5928 Washington Blvd",2026-07-17,1
Alexander,Martin,alexander.martin.0018@example.com,+13028966555,"3250 Sunset Blvd, Seaford, DE, USA ChIJ982537033 3250 Sunset Blvd",07/18/2026,2
Elias,Long,elias.long.0019@example.com,+13024422852,"9362 Highland Ave, Smyrna, DE, USA ChIJ517675810 9362 Highland Ave","Jul 3rd 2026, 7:03 am",2
Ethan,Bennett,ethan.bennett.0020@example.com,+13029148405,"2500 Meadow Ln, Wilmington, DE, USA ChIJ642907023 2500 Meadow Ln",2026-07-20,2
Brianna,Thomas,brianna.thomas.0021@example.com,+13029834362,"1841 Maple St, Milford, DE, USA ChIJ138157604 1841 Maple St",07/21/2026,2
Julian,Henderson,julian.henderson.0022@example.com,+13028747496,"3832 Elm St, Middletown, DE, USA ChIJ756153522 3832 Elm St","Jul 9th 2026, 10:12 am",4
Joshua,Jones,joshua.jones.0023@example.com,+13028895106,"428 Willow Way, Georgetown, DE, USA ChIJ525265440 428 Willow Way",2026-07-23,2
Ella,Murphy,ella.murphy.0024@example.com,+13026481684,"5371 Willow Way, Newark, DE, USA ChIJ439034350 5371 Willow Way",07/24/2026,4
Dominic,Fisher,dominic.fisher.0025@example.com,+13024985517,"4218 River Rd, Seaford, DE, USA ChIJ523515740 4218 River Rd","Jul 11th 2026, 2:42 am",1
Riley,Morgan,riley.morgan.0026@example.com,+13023225296,"8255 Chestnut Ct, Milford, DE, USA ChIJ176640916 8255 Chestnut Ct",2026-07-26,1
Anthony,Simmons,anthony.simmons.0027@example.com,+13029775693,"8121 Elm St, Bear, DE, USA ChIJ760271252 8121 Elm St",07/27/2026,1
Alyssa,Roberts,alyssa.roberts.0028@example.com,+13029102375,"4336 Washington Blvd, Dover, DE, USA ChIJ865233888 4336 Washington Blvd","Jul 15th 2026, 9:59 pm",3
Alice,Hughes,alice.hughes.0029@example.com,+13025638166,"5907 Chestnut Ct, Milford, DE, USA ChIJ520833340 5907 Chestnut Ct",2026-07-02,4
Audrey,Martin,audrey.martin.0030@example.com,+13025126207,"2856 Washington Blvd, Smyrna, DE, USA ChIJ833739629 2856 Washington Blvd",07/03/2026,2
Jayden,Washington,jayden.washington.0031@example.com,+13028913841,"3003 Maple St, Wilmington, DE, USA ChIJ342788907 3003 Maple St","Jul 15th 2026, 5:51 am",2
Caleb,Jenkins,caleb.jenkins.0032@example.com,+13024501093,"3261 Pine Rd, Dover, DE, USA ChIJ312458668 3261 Pine Rd",2026-07-05,4
Deborah,Hill,deborah.hill.0033@example.com,+13026957074,"1741 Garden St, New Castle, DE, USA ChIJ202340872 1741 Garden St",07/06/2026,1
Evelyn,Anderson,evelyn.anderson.0034@example.com,+13026643165,"5374 Sunset Blvd, Wilmington, DE, USA ChIJ491166938 5374 Sunset Blvd","Jul 14th 2026, 10:11 am",4
Michelle,Rivera,michelle.rivera.0035@example.com,+13028183063,"8264 Maple St, Georgetown, DE, USA ChIJ172842374 8264 Maple St",2026-07-08,1
Henry,Lewis,henry.lewis.0036@example.com,+13025077137,"4754 Washington Blvd, Georgetown, DE, USA ChIJ957304891 4754 Washington Blvd",07/09/2026,1
Michelle,Alexander,michelle.alexander.0037@example.com,+13023478386,"7691 Oak Ave, New Castle, DE, USA ChIJ698497718 7691 Oak Ave","Jul 6th 2026, 10:13 am",4
Andrew,Cruz,andrew.cruz.0038@example.com,+13023871461,"3813 Cedar Ln, Dover, DE, USA ChIJ444705730 3813 Cedar Ln",2026-07-11,2
Robert,Adams,robert.adams.0039@example.com,+13024193109,"4469 Sunset Blvd, Wilmington, DE, USA ChIJ637953536 4469 Sunset Blvd",07/12/2026,2
Mateo,Wright,mateo.wright.0040@example.com,+13026177736,"5116 Oak Ave, Seaford, DE, USA ChIJ501400680 5116 Oak Ave","Jul 2nd 2026, 8:16 pm",4
